Author,Title,Poetry Foundation ID,Content,Length,Topics
Emily Dickinson,The Moon is distant from the Sea - (387,52198,"The Moon is distant from the Sea -
And yet, with Amber Hands -
She leads Him - docile as a Boy -
Along appointed Sands -

He never misses a Degree -
Obedient to Her eye -
He comes just so far - toward the Town -
Just so far - goes away -

Oh, Signor, Thine, the Amber Hand -
And mine - the distant Sea -
Obedient to the least command
Thine eye impose on me -",65,"distant sea, impose, hand, town, signor, sands, obedient, mine, hands, docile, degree, command"
Emily Dickinson,Safe in their Alabaster Chambers (124,45719,"Safe in their Alabaster Chambers -
Untouched by Morning -
and untouched by noon -
Sleep the meek members of the Resurrection,
Rafter of Satin and Roof of Stone -

Grand go the Years,
In the Crescent above them -
Worlds scoop their Arcs -
and Firmaments - row -
Diadems - drop -
And Doges surrender -
Soundless as Dots,
On a Disk of Snow",55,"meek members, alabaster chambers, safe, grand, drop, years, worlds, untouched, stone"
Emily Dickinson,To fight aloud is very brave - (138,55871,"To fight aloud, is very brave -
But gallanter, I know
Who charge within the bosom
The Calvalry of Wo -

Who win, and nations do not see -
Who fall - and none observe -
Whose dying eyes, no Country
Regards with patriot love -

We trust, in plumed procession
For such, the Angels go -
Rank after Rank, with even feet -
And Uniforms of snow",60,"plumed procession, brave, uniforms, snow, rank, patriot, nations"
Emily Dickinson,"It was not Death, for I stood up, (355",44085,"Highlight Actions
Enable or disable annotations
It was not Death, for I stood up,
And all the Dead, lie down -
It was not Night, for all the Bells
Put out their
Tongues
Tongues
The clappers inside of the bells
, for Noon.

It was not Frost, for on my Flesh
I felt
Siroccos
Siroccos
Hot winds. The Emily Dickinson Lexicon includes definitions from the American Dictionary of the English Language (1844): ""A pernicious wind that blows from the south-east in Italy, called the Syrian wind. It is said to resemble the steam from the mouth of an oven.""
- crawl -
Nor Fire - for just my marble feet
Could keep a
Chancel,
Chancel
The section near the altar of a church
cool -

And yet, it tasted, like them all,
The Figures I have seen
Set orderly, for Burial
Reminded me, of mine -

As if my life were shaven,
And fitted to a frame,
And could not breathe without a key,
And it was like Midnight, some -

When everything that ticked - has stopped -
And space stares - all around -
Or Grisly frosts - first Autumn morns,
Repeal the Beating Ground -

But most, like Chaos - Stopless - cool -
Without a Chance, or
spar
spar
The top mast of a ship
-
Or even a Report of Land -
To justify - Despair",213,"beating ground, syrian wind, space stares, pernicious wind, marble feet, english language, disable annotations, dickinson lexicon, american dictionary, highlight, fire, despair, death, dead, cool"
Emily Dickinson,The Props assist the House (729,48747,"The Props assist the House
Until the House is built
And then the Props withdraw
And adequate, erect,
The House support itself
And cease to recollect
The Augur and the Carpenter -
Just such a retrospect
Hath the perfected Life -
A Past of Plank and Nail
And slowness - then the scaffolds drop
Affirming it a Soul -",55,"perfected life, house support, drop, adequate, soul, slowness, scaffolds, retrospect, props, plank, past, nail, erect, cease"
Emily Dickinson,The Soul has Bandaged moments - (360,56453,"The Soul has Bandaged moments -
When too appalled to stir -
She feels some ghastly Fright come up
And stop to look at her -

Salute her, with long fingers -
Caress her freezing hair -
Sip, Goblin, from the very lips
The Lover - hovered - over -
Unworthy, that a thought so mean
Accost a Theme - so - fair -

The soul has moments of escape -
When bursting all the doors -
She dances like a Bomb, abroad,
And swings opon the Hours,

As do the Bee - delirious borne -
Long Dungeoned from his Rose -
Touch Liberty - then know no more -
But Noon, and Paradise

The Soul's retaken moments -
When, Felon led along,
With shackles on the plumed feet,
And staples, in the song,

The Horror welcomes her, again,
These, are not brayed of Tongue ",127,"retaken moments, plumed feet, unworthy, lover, horror, freezing, fair"
Emily Dickinson,My Life had stood - a Loaded Gun (764,52737,"My Life had stood - a Loaded Gun -
In Corners - till a Day
The Owner passed - identified -
And carried Me away -

And now We roam in Sovreign Woods -
And now We hunt the Doe -
And every time I speak for Him
The Mountains straight reply -

And do I smile, such cordial light
Opon the Valley glow -
It is as a Vesuvian face
Had let it's pleasure through -

And when at Night - Our good Day done -
I guard My Master's Head -
It is better than the Eider Duck's
Deep Pillow - to have shared -

To foe of His - I'm deadly foe -
None stir the second time -
On whom I lay a Yellow Eye -
Or an emphatic Thumb -

Though I than He - may longer live
He longer must - than I -
For I have but the power to kill,
Without - the power to die ",142,"loaded gun, yellow eye, vesuvian face, sovreign woods, emphatic thumb, eider duck, deep pillow, cordial light"
Emily Dickinson,Publication - is the Auction (788,52204,"Publication - is the Auction
Of the Mind of Man -
Poverty - be justifying
For so foul a thing

Possibly - but We - would rather
From Our Garret go
White - unto the White Creator -
Than invest - Our Snow -

Thought belong to Him who gave it -
Then - to Him Who bear
It's Corporeal illustration - sell
The Royal Air -

In the Parcel - Be the Merchant
Of the Heavenly Grace -
But reduce no Human Spirit
To Disgrace of Price -",74,"human spirit, white creator, corporeal illustration, poverty, heavenly, disgrace, snow, sell, publication, price, possibly, parcel, mind"
Emily Dickinson,Crumbling is not an instant's Act (1010,56823,"Crumbling is not an instant's Act
A fundamental pause
Dilapidation's processes
Are organized Decays -

It is first a Cobweb on the Soul
A Cuticle of Dust
A Borer in the Axis
An Elemental Rust -

Ruin is formal - Devil's work
Consecutive and slow -
Fail in an instant, no man did
Slipping - is Crashe's law -",57,"fundamental pause, elemental rust, ruin, fail, devil, decays, borer, work, soul, slow"
Emily Dickinson,"After great pain, a formal feeling comes - (372",47651,"After great pain, a formal feeling comes -
The Nerves sit ceremonious, like Tombs -
The stiff Heart questions 'was it He, that bore,'
And 'Yesterday, or Centuries before'?

The Feet, mechanical, go round -
A Wooden way
Of Ground, or Air, or Ought -
Regardless grown,
A Quartz contentment, like a stone -

This is the Hour of Lead -
Remembered, if outlived,
As Freezing persons, recollect the Snow -
First - Chill - then Stupor - then the letting go -",72,"quartz contentment, formal feeling, stiff heart, heart questions, pain, nerves, freezing, bore, yesterday, wooden, stone"
Emily Dickinson,It sifts from Leaden Sieves - (291,51610,"It sifts from Leaden Sieves -
It powders all the Wood.
It fills with Alabaster Wool
The Wrinkles of the Road -

It makes an even Face
Of Mountain, and of Plain -
Unbroken Forehead from the East
Unto the East again -

It reaches to the Fence -
It wraps it Rail by Rail
Till it is lost in Fleeces -
It deals Celestial Vail

To Stump, and Stack - and Stem -
A Summer's empty Room -
Acres of Joints, where Harvests were,
Recordless, but for them -

It Ruffles Wrists of Posts
As Ankles of a Queen -
Then stills it's Artisans - like Ghosts -
Denying they have been ",102,"empty room, unbroken forehead, leaden sieves, celestial vail, alabaster wool, denying, wrists, wrinkles, wood, road, recordless, rail"
Emily Dickinson,How many times these low feet staggered (238,51611,"How many times these low feet staggered -
Only the soldered mouth can tell -
Try - can you stir the awful rivet -
Try - can you lift the hasps of steel!

Stroke the cool forehead - hot so often -
Lift - if you care - the listless hair -
Handle the adamantine fingers
Never a thimble - more - shall wear -

Buzz the dull flies - on the chamber window -
Brave - shines the sun through the freckled pane -
Fearless - the cobweb swings from the ceiling -
Indolent Housewife - in Daisies - lain",80,"awful rivet, listless hair, indolent housewife, cobweb swings, adamantine fingers, fearless, dull, cool, times, thimble, steel, pane, mouth, lift"
Emily Dickinson,A narrow Fellow in the Grass (1096,49909,"A narrow Fellow in the Grass
Occasionally rides -
You may have met him? Did you not
His notice instant is -

The Grass divides as with a Comb,
A spotted Shaft is seen,
And then it closes at your Feet
And opens further on -

He likes a Boggy Acre -
A Floor too cool for Corn -
But when a Boy and Barefoot
I more than once at Noon

Have passed I thought a Whip Lash
Unbraiding in the Sun
When stooping to secure it
It wrinkled And was gone -

Several of Nature's People
I know, and they know me
I feel for them a transport
Of Cordiality

But never met this Fellow
Attended or alone
Without a tighter Breathing
And Zero at the Bone",123,"whip lash, spotted shaft, notice instant, narrow fellow, boggy acre, cool, unbraiding, transport, tighter"
Emily Dickinson,Success is counted sweetest (112,45721,"Success is counted sweetest
By those who never succeed.
To comprehend a nectar
Requires sorest need.

Not one of all the purple Host
Who took the Flag today
Can tell the definition
So clear of victory

As he defeated - dying -
On whose forbidden ear
The distant strains of triumph
Burst agonized and clear",53,"forbidden ear, distant strains, purple host, flag today, triumph, success, clear, victory, sweetest, sorest"
Emily Dickinson,"A Bird, came down the Walk - (359",56593,"A Bird, came down the Walk -
He did not know I saw -
He bit an Angle Worm in halves
And ate the fellow, raw,

And then, he drank a Dew
From a convenient Grass -
And then hopped sidewise to the Wall
To let a Beetle pass -

He glanced with rapid eyes,
That hurried all abroad -
They looked like frightened Beads, I thought,
He stirred his Velvet Head. -

Like one in danger, Cautious,
I offered him a Crumb,
And he unrolled his feathers,
And rowed him softer Home -

Than Oars divide the Ocean,
Too silver for a seam,
Or Butterflies, off Banks of Noon,
Leap, plashless as they swim",108,"frightened beads, rapid eyes, convenient grass, beetle pass, danger, cautious, worm"
Emily Dickinson,Now I knew I lost her - (1274,56825,"Now I knew I lost her -
Not that she was gone -
But Remoteness travelled
On her Face and Tongue.

Alien, though adjoining
As a Foreign Race -
Traversed she though pausing
Latitudeless Place.

Elements Unaltered -
Universe the same
But Love's transmigration -
Somehow this had come -

Henceforth to remember
Nature took the Day
I had paid so much for -
His is Penury
Not who toils for Freedom
Or for Family
But the Restitution
Of Idolatry",74,"latitudeless place, foreign race, freedom, unaltered, transmigration, tongue, restitution, remoteness, penury"
Emily Dickinson,I know that He exists. (365,52137,"I know that He exists.
Somewhere - in silence -
He has hid his rare life
From our gross eyes.

It is an instant's play -
It is a fond Ambush -
Just to make Bliss
Earn her own surprise!

But - should the play
Prove piercing earnest -
Should the glee - glaze -
In Death's - stiff - stare -

Would not the fun
Look too expensive!
Would not the jest -
Have crawled too far",68,"gross eyes, rare life, surprise, play, glee, fond, death, bliss, stiff"
Emily Dickinson,The Mushroom is the Elf of Plants - (1350,56458,"The Mushroom is the Elf of Plants -
At Evening, it is not
At Morning, in a Truffled Hut
It stop opon a Spot

As if it tarried always
And yet it's whole Career
Is shorter than a Snake's Delay -
And fleeter than a Tare -

It is Vegetation's Juggler -
The Germ of Alibi -
Doth like a Bubble antedate
And like a Bubble, hie -

I feel as if the Grass was pleased
To have it intermit -
This surreptitious Scion
Of Summer's circumspect.

Had Nature any supple Face
Or could she one contemn -
Had Nature an Apostate -
That Mushroom - it is Him",103,"truffled hut, surreptitious scion, supple face, bubble antedate, pleased, delay, vegetation, tare, spot, snake, shorter, plants"
Emily Dickinson,This World is not Conclusion (373,47653,"This World is not Conclusion.
A Species stands beyond -
Invisible, as Music -
But positive, as Sound -
It beckons, and it baffles -
Philosophy, dont know -
And through a Riddle, at the last -
Sagacity, must go -
To guess it, puzzles scholars -
To gain it, Men have borne
Contempt of Generations
And Crucifixion, shown -
Faith slips - and laughs, and rallies -
Blushes, if any see -
Plucks at a twig of Evidence -
And asks a Vane, the way -
Much Gesture, from the Pulpit -
Strong Hallelujahs roll -
Narcotics cannot still the Tooth
That nibbles at the soul ",92,"strong hallelujahs, hallelujahs roll, positive, laughs, contempt, world, vane, twig, tooth, species, sound, soul, scholars, sagacity, riddle"
Emily Dickinson,"Because I could not stop for Death - (479)
 
 
  
   Launch Audio in a New Window",47652,"Because I could not stop for Death -
He kindly stopped for me -
The Carriage held but just Ourselves -
And Immortality.

We slowly drove - He knew no haste
And I had put away
My labor and my leisure too,
For His Civility -

We passed the School, where Children strove
At Recess - in the Ring -
We passed the Fields of Gazing Grain -
We passed the Setting Sun -

Or rather - He passed Us -
The Dews drew quivering and Chill -
For only Gossamer, my Gown -
My Tippet - only Tulle -

We paused before a House that seemed
A Swelling of the Ground -
The Roof was scarcely visible -
The Cornice - in the Ground -

Since then - it is Centuries - and yet
Feels shorter than the Day
I first surmised the Horses' Heads
Were toward Eternity -",128,"kindly, death, visible, tippet, swelling, shorter, setting, school, scarcely, roof, ring"
Emily Dickinson,Some keep the Sabbath going to Church - (236,52138,"Some keep the Sabbath going to Church -
I keep it, staying at Home -
With a Bobolink for a Chorister -
And an Orchard, for a Dome -

Some keep the Sabbath in Surplice -
I, just wear my Wings -
And instead of tolling the Bell, for Church,
Our little Sexton - sings.

God preaches, a noted Clergyman -
And the sermon is never long,
So instead of getting to Heaven, at last -
I'm going, all along",72,"noted clergyman, wings, wear, tolling, surplice, staying, sings, sexton"
Emily Dickinson,I like to see it lap the Miles - (383,56019,"I like to see it lap the Miles -
And lick the Valleys up -
And stop to feed itself at Tanks -
And then - prodigious step

Around a Pile of Mountains -
And supercilious peer
In Shanties - by the sides of Roads -
And then a Quarry pare

To fit its sides
And crawl between
Complaining all the while
In horrid - hooting stanza -
Then chase itself down Hill -

And neigh like Boanerges -
Then - prompter than a Star
Stop - docile and omnipotent
At it's own stable door ",83,"stable door, supercilious peer, quarry pare, prodigious step, horrid, complaining, valleys, tanks, stanza, sides, shanties, roads, prompter, pile"
Emily Dickinson,I would not paint - a picture - (348,56821,"I would not paint - a picture -
Ied rather be the One
It's bright impossibility
To dwell - delicious - on -
And wonder how the fingers feel
Whose rare - celestial - stir -
Evokes so sweet a torment -
Such sumptuous - Despair -

I would not talk, like Cornets -
Ied rather be the One
Raised softly to the Ceilings -
And out, and easy on -
Through Villages of Ether -
Myself endued Balloon
By but a lip of Metal -
The pier to my Pontoon -

Nor would I be a Poet -
It's finer - Own the Ear -
Enamored - impotent - content -
The License to revere,
A privilege so awful
What would the Dower be,
Had I the Art to stun myself
With Bolts - of Melody",115,"bright impossibility, privilege, impotent, despair, delicious, awful, villages, torment, sumptuous"
Emily Dickinson,I dwell in Possibility - (466,52197,"I dwell in Possibility -
A fairer House than Prose -
More numerous of Windows -
Superior - for Doors -

Of Chambers as the Cedars -
Impregnable of eye -
And for an everlasting Roof
The Gambrels of the Sky -

Of Visitors - the fairest -
For Occupation - This -
The spreading wide my narrow Hands
To gather Paradise -",50,"narrow hands, fairer house, everlasting roof, superior, paradise, windows, wide"
Emily Dickinson,They shut me up in Prose - (445,52196,"They shut me up in Prose -
As when a little Girl
They put me in the Closet -
Because they liked me ""still""   -

Still! Could themself have peeped -
And seen my Brain - go round -
They might as wise have lodged a Bird
For Treason - in the Pound -

Himself has but to will
And easy as a Star
Look down opon Captivity -
And laugh - No more have I -",68,"wise, treason, round, prose, pound, opon, girl, closet, captivity, bird"
Emily Dickinson,"All overgrown by cunning moss, (146",52200,"All overgrown by cunning moss,
All interspersed with weed,
The little cage of ""Currer Bell""
In quiet ""Haworth"" laid.

This Bird - observing others
When frosts too sharp became
Retire to other latitudes -
Quietly did the same -

But differed in returning -
Since Yorkshire hills are green -
Yet not in all the nests I meet -
Can Nightingale be seen -",61,"yorkshire hills, weed, sharp, returning, retire, quietly, quiet, observing, nests, moss, latitudes, haworth, green"
Emily Dickinson,I heard a Fly buzz - when I died - (591,45703,"I heard a Fly buzz - when I died -
The Stillness in the Room
Was like the Stillness in the Air -
Between the Heaves of Storm -

The Eyes around - had wrung them dry -
And Breaths were gathering firm
For that last Onset - when the King
Be witnessed - in the Room -

I willed my Keepsakes - Signed away
What portion of me be
Assignable - and then it was
There interposed a Fly -

With Blue - uncertain - stumbling Buzz -
Between the light - and me -
And then the Windows failed - and then
I could not see to see ",92,"uncertain, windows, stumbling, storm, stillness, room, portion, light, keepsakes, heaves, gathering, firm, eyes, breaths, blue"
Emily Dickinson,"There's a certain Slant of light, (320",45723,"There's a certain Slant of light,
Winter Afternoons -
That oppresses, like the Heft
Of Cathedral Tunes -

Heavenly Hurt, it gives us -
We can find no scar,
But internal difference -
Where the Meanings, are -

None may teach it - Any -
It is the seal Despair -
An imperial affliction
Sent us of the Air -

When it comes, the Landscape listens -
Shadows - hold their breath -
When it goes, it is like the Distance
On the look of Death -",75,"seal despair, internal difference, imperial affliction, cathedral tunes, heavenly, death, slant, scar, meanings, light, landscape"
Emily Dickinson,"I felt a Funeral, in my Brain, (340",45706,"I felt a Funeral, in my Brain,
And Mourners to and fro
Kept treading - treading - till it seemed
That Sense was breaking through -

And when they all were seated,
A Service, like a Drum -
Kept beating - beating - till I thought
My mind was going numb -

And then I heard them lift a Box
And creak across my Soul
With those same Boots of Lead, again,
Then Space - began to toll,

As all the Heavens were a Bell,
And Being, but an Ear,
And I, and Silence, some strange Race,
Wrecked, solitary, here -

And then a Plank in Reason, broke,
And I dropped down, and down -
And hit a World, at every plunge,
And Finished knowing - then ",116,"strange race, numb, mourners, heavens, funeral, beating, world, treading, space, soul, solitary, silence"
Emily Dickinson,Forever - is composed of Nows - (690,52202,"Forever - is composed of Nows -
It is not a different time -
Except for Infiniteness -
And Latitude of Home -

From this - experienced Here -
Remove the Dates - to These -
Let Months dissolve in further Months -
And Years - exhale in Years -

Without Debate - or Pause -
Or Celebrated Days -
No different Our Years would be
From Anno Dominies -",54,"anno dominies, years, time, nows, months, latitude, infiniteness, forever, exhale, debate, days, dates"
Emily Dickinson,I never hear that one is dead (1325,56457,"I never hear that one is dead
Without the chance of Life
Afresh annihilating me
That mightiest Belief,

Too mighty for the Daily mind
That tilling it's abyss,
Had Madness, had it once or, Twice
The yawning Consciousness,

Beliefs are Bandaged, like the Tongue
When Terror were it told
In any Tone commensurate
Would strike us instant Dead -

I do not know the man so bold
He dare in lonely Place
That awful stranger - Consciousness
Deliberately face ",78,"lonely place, yawning consciousness, tone commensurate, mightiest belief, daily mind, terror, madness, dead, bold, awful, tongue"
Emily Dickinson,"I started Early - Took my Dog - (656)
 
 
  
   Launch Audio in a New Window",50976,"Highlight Actions
Enable or disable annotations
I started Early - Took my Dog -
And visited the Sea -
The Mermaids in the
Basement
Basement
i.e., the bottom of the ocean

Came out to look at me -

And
Frigates
Frigates
fast and highly maneuverable warships of the 18th and 19th centuries, used to escort other larger ships, or to patrol the coast and blockade harbors
- in the Upper Floor
Extended
Hempen Hands
Hempen Hands
strong, thick ropes made of hemp, used on ships
-
Presuming Me to be a Mouse -
Aground -
opon
opon
upon
the Sands -

But no Man moved Me - till the Tide
Went past my simple Shoe -
And past my Apron - and my Belt
And past my
Boddice
Boddice
bodice; an upper part of a woman's dress, or a rigid, laced corset worn underneath clothing, covering the upper part of a woman's body
- too -

And made as He would eat me up -
As wholly as a Dew
Opon a Dandelion's Sleeve -
And then - I started - too -

And He - He followed - close behind -
I felt His Silver Heel
Opon my Ancle - Then My Shoes
Would overflow with Pearl -

Until We met the Solid Town -
No One He seemed to know -
And bowing - with a Mighty look -
At me - The Sea withdrew -",211,"worn underneath, solid town, maneuverable warships, upper floor, underneath clothing, thick ropes, silver heel, larger ships, laced corset"
Emily Dickinson,Before I got my eye put out - (336,52135,"Before I got my eye put out -
I liked as well to see
As other creatures, that have eyes -
And know no other way -

But were it told to me, Today,
That I might have the Sky
For mine, I tell you that my Heart
Would split, for size of me -

The Meadows - mine -
The Mountains - mine -
All Forests - Stintless stars -
As much of noon, as I could take -
Between my finite eyes -

The Motions of the Dipping Birds -
The Morning's Amber Road -
For mine - to look at when I liked,
The news would strike me dead -

So safer - guess - with just my soul
Opon the window pane
Where other creatures put their eyes -
Incautious - of the Sun -",119,"window pane, finite eyes, dipping birds, safer, dead, today, stintless, soul, size, road, noon, news, mountains, motions, morning"
Ezra Pound,"To Whistler, American",12587,"On the loan exhibit of his paintings at the Tate Gallery.
You also, our first great,
Had tried all ways;
Tested and pried and worked in many fashions,
And this much gives me heart to play the game.

Here is a part that's slight, and part gone wrong,
And much of little moment, and some few
Perfect as Dürer!

""In the Studio"" and these two portraits,* if I had my choice I
And then these sketches in the mood of Greece?

You had your searches, your uncertainties,
And this is good to know-for us, I mean,
Who bear the brunt of our America
And try to wrench her impulse into art.

You were not always sure, not always set
To hiding night or tuning ""symphonies"";
Had not one style from birth, but tried and pried
And stretched and tampered with the media.

You and Abe Lincoln from that mass of dolts
Show us there's chance at least of winning through.


* ""Brown and Gold-de Race.""
""Grenat et Or-Le Pettt Cardinal",178,"tate gallery, pettt cardinal, or-le pettt, gold-de race, wrong, winning, uncertainties"
Ezra Pound,Envoi,44914,"Go, dumb-born book,
Tell her that sang me once that song of Lawes:
Hadst thou but song
As thou hast subjects known,
Then were there cause in thee that should condone
Even my faults that heavy upon me lie
And build her glories their longevity.

Tell her that sheds
Such treasure in the air,
Recking naught else but that her graces give
Life to the moment,
I would bid them live
As roses might, in magic amber laid,
Red overwrought with orange and all made
One substance and one colour
Braving time.

Tell her that goes
With song upon her lips
But sings not out the song, nor knows
The maker of it, some other mouth,
May be as fair as hers,
Might, in new ages, gain her worshippers,
When our two dusts with Waller's shall be laid,
Siftings on siftings in oblivion,
Till change hath broken down
All things save Beauty alone",154,"dumb-born book, braving time, worshippers, treasure, graces, glories, faults, fair, beauty, waller, things, substance, subjects, sings"
Ezra Pound,Cantico del Sole,52318,"The thought of what America would be like
If the Classics had a wide circulation
Troubles my sleep,
The thought of what America,
The thought of what America,
The thought of what America would be like
If the Classics had a wide circulation
Troubles my sleep.
Nunc dimittis, now lettest thou thy servant,
Now lettest thou thy servant
Depart in peace.
The thought of what America,
The thought of what America,
The thought of what America would be like
If the Classics had a wide circulation . . .
Oh well!
It troubles my sleep",92,"wide circulation, nunc dimittis, troubles, peace, sleep, servant, lettest, depart"
