Author,Title,Poetry Foundation ID,Content,Length,Topics
"Alfred, Lord Tennyson",St. Agnes' Eve,45388,"Deep on the convent-roof the snows
Are sparkling to the moon:
My breath to heaven like vapour goes;
May my soul follow soon!
The shadows of the convent-towers
Slant down the snowy sward,
Still creeping with the creeping hours
That lead me to my Lord:
Make Thou my spirit pure and clear
As are the frosty skies,
Or this first snowdrop of the year
That in my bosom lies.

As these white robes are soiled and dark,
To yonder shining ground;
As this pale taper's earthly spark,
To yonder argent round;
So shows my soul before the Lamb,
My spirit before Thee;
So in mine earthly house I am,
To that I hope to be.
Break up the heavens, O Lord! and far,
Thro' all yon starlight keen,
Draw me, thy bride, a glittering star,
In raiment white and clean.

He lifts me to the golden doors;
The flashes come and go;
All heaven bursts her starry floors,
And strows her lights below,
And deepens on and up! the gates
Roll back, and far within
For me the Heavenly Bridegroom waits,
To make me pure of sin.
The sabbaths of Eternity,
One sabbath deep and wide-
A light upon the shining sea-
The Bridegroom with his bride",208,"heaven bursts, earthly spark, spirit pure, white robes, starry floors, snowy sward, sabbath deep, pale taper, frosty skies, earthly house, creeping hours, bridegroom waits, argent round"
"Alfred, Lord Tennyson",Claribel,45320,"Where Claribel low-lieth
The breezes pause and die,
Letting the rose-leaves fall:
But the solemn oak-tree sigheth,
Thick-leaved, ambrosial,
With an ancient melody
Of an inward agony,
Where Claribel low-lieth.

At eve the beetle boometh
Athwart the thicket lone:
At noon the wild bee hummeth
About the mossed headstone:
At midnight the moon cometh,
And looketh down alone.
Her song the lintwhite swelleth,
The clear-voiced mavis dwelleth,
The callow throstle lispeth,
The slumbrous wave outwelleth,
The babbling runnel crispeth,
The hollow grot replieth
Where Claribel low-lieth",86,"thicket lone, wave outwelleth, throstle lispeth, slumbrous wave, runnel crispeth, rose-leaves fall, oak-tree sigheth, mossed headstone, lintwhite swelleth, hollow grot, grot replieth, callow throstle, breezes pause"
"Alfred, Lord Tennyson","You Ask Me, Why, Tho' Ill at Ease",45393,"You ask me, why, tho' ill at ease,
Within this region I subsist,
Whose spirits falter in the mist,
And languish for the purple seas.

It is the land that freemen till,
That sober-suited Freedom chose,
The land, where girt with friends or foes
A man may speak the thing he will;

A land of settled government,
A land of just and old renown,
Where Freedom slowly broadens down
From precedent to precedent:

Where faction seldom gathers head,
But by degrees to fullness wrought,
The strength of some diffusive thought
Hath time and space to work and spread.

Should banded unions persecute
Opinion, and induce a time
When single thought is civil crime,
And individual freedom mute;

Tho' Power should make from land to land
The name of Britain trebly great-
Tho' every channel of the State
Should fill and choke with golden sand-

Yet waft me from the harbour-mouth,
Wild wind! I seek a warmer sky,
And I will see before I die
The palms and temples of the South",171,"sober-suited freedom, individual freedom, freedom mute, freedom chose, civil crime, warmer sky, settled government"
"Alfred, Lord Tennyson","Break, Break, Break",45318,"Break, break, break,
On thy cold gray stones, O Sea!
And I would that my tongue could utter
The thoughts that arise in me.

O, well for the fisherman's boy,
That he shouts with his sister at play!
O, well for the sailor lad,
That he sings in his boat on the bay!

And the stately ships go on
To their haven under the hill;
But O for the touch of a vanished hand,
And the sound of a voice that is still!

Break, break, break
At the foot of thy crags, O Sea!
But the tender grace of a day that is dead
Will never come back to me",111,"vanished hand, stately ships, sailor lad, gray stones, play, dead, voice, touch, tongue, thoughts, tender"
"Alfred, Lord Tennyson",Marriage Morning,50299,"Light, so low upon earth,
You send a flash to the sun.
Here is the golden close of love,
All my wooing is done.
Oh, all the woods and the meadows,
Woods, where we hid from the wet,
Stiles where we stayed to be kind,
Meadows in which we met!
Light, so low in the vale
You flash and lighten afar,
For this is the golden morning of love,
And you are his morning star.
Flash, I am coming, I come,
By meadow and stile and wood,
Oh, lighten into my eyes and my heart,
Into my heart and my blood!
Heart, are you great enough
For a love that never tires?
O heart, are you great enough for love?
I have heard of thorns and briers.
Over the thorns and briers,
Over the meadows and stiles,
Over the world to the end of it
Flash of a million miles",150,"kind, world, wooing, woods, wood, vale, thorns, stiles, stile, morning, meadows, meadow, lighten, light, heart"
"Alfred, Lord Tennyson",Of Old Sat Freedom on the Heights,45374,"Of old sat Freedom on the heights,
The thunders breaking at her feet:
Above her shook the starry lights:
She heard the torrents meet.

There in her place she did rejoice,
Self-gathered in her prophet-mind,
But fragments of her mighty voice
Came rolling on the wind.

Then stept she down thro' town and field
To mingle with the human race,
And part by part to men revealed
The fulness of her face-

Grave mother of majestic works,
From her isle-altar gazing down,
Who, God-like, grasps the triple forks,
And, King-like, wears the crown:

Her open eyes desire the truth.
The wisdom of a thousand years
Is in them. May perpetual youth
Keep dry their light from tears;

That her fair form may stand and shine,
Make bright our days and light our dreams,
Turning to scorn with lips divine
The falsehood of extremes",143,"fair form, triple forks, starry lights, perpetual youth, open eyes, mighty voice, majestic works, human race, wisdom, truth, tears, shook, rejoice, freedom"
"Alfred, Lord Tennyson","Late, Late, so Late",45361,"Late, late, so late! and dark the night and chill!
Late, late, so late! but we can enter still.
Too late, too late! ye cannot enter now.

No light had we: for that we do repent;
And learning this, the bridegroom will relent.
Too late, too late! ye cannot enter now.

No light: so late! and dark and chill the night!
O, let us in, that we may find the light!
Too late, too late: ye cannot enter now.

Have we not heard the bridegroom is so sweet?
O, let us in, tho' late, to kiss his feet!
No, no, too late! ye cannot enter now",110,"sweet, repent, night, light, learning, late, feet, dark, chill, bridegroom"
"Alfred, Lord Tennyson",In Memoriam A. H. H. OBIIT MDCCCXXXIII: 82,45346,"I wage not any feud with Death
For changes wrought on form and face;
No lower life that earth's embrace
May breed with him, can fright my faith.

Eternal process moving on,
From state to state the spirit walks;
And these are but the shattered stalks,
Or ruined chrysalis of one.

Nor blame I Death, because he bare
The use of virtue out of earth:
I know transplanted human worth
Will bloom to profit, otherwhere.

For this alone on Death I wreak
The wrath that garners in my heart;
He put our lives so far apart
We cannot hear each other speak",104,"shattered stalks, lower life, human worth, spirit walks, eternal process, virtue, feud, embrace, death, blame, wrath"
"Alfred, Lord Tennyson","from
  
  The Princess: The Splendour Falls on Castle Walls",45385,"The splendour falls on castle walls
And snowy summits old in story:
The long light shakes across the lakes,
And the wild cataract leaps in glory.
Blow, bugle, blow, set the wild echoes flying,
Blow, bugle; answer, echoes, dying, dying, dying.

O hark, O hear! how thin and clear,
And thinner, clearer, farther going!
O sweet and far from cliff and scar
The horns of Elfland faintly blowing!
Blow, let us hear the purple glens replying:
Blow, bugle; answer, echoes, dying, dying, dying.

O love, they die in yon rich sky,
They faint on hill or field or river:
Our echoes roll from soul to soul,
And grow for ever and for ever.
Blow, bugle, blow, set the wild echoes flying,
And answer, echoes, answer, dying, dying, dying",128,"wild echoes, wild cataract, light shakes, cataract leaps, castle walls, sweet, splendour, clear, thinner, thin, summits, story, soul, scar"
"Alfred, Lord Tennyson",In Memoriam A. H. H. OBIIT MDCCCXXXIII: 22,45335,"The path by which we twain did go,
Which led by tracts that pleased us well,
Thro' four sweet years arose and fell,
From flower to flower, from snow to snow:

And we with singing cheered the way,
And, crowned with all the season lent,
From April on to April went,
And glad at heart from May to May:

But where the path we walked began
To slant the fifth autumnal slope,
As we descended following Hope,
There sat the Shadow feared of man;

Who broke our fair companionship,
And spread his mantle dark and cold,
And wrapt thee formless in the fold,
And dulled the murmur on thy lip,

And bore thee where I could not see
Nor follow, tho' I walk in haste,
And think, that somewhere in the waste
The Shadow sits and waits for me",139,"sweet years, fair companionship, shadow sits, mantle dark, autumnal slope, waste, glad, bore, wrapt, waits, tracts, snow"
"Alfred, Lord Tennyson",In Memoriam A. H. H. OBIIT MDCCCXXXIII: 27,45336,"I envy not in any moods
The captive void of noble rage,
The linnet born within the cage,
That never knew the summer woods:

I envy not the beast that takes
His license in the field of time,
Unfettered by the sense of crime,
To whom a conscience never wakes;

Nor, what may count itself as blest,
The heart that never plighted troth
But stagnates in the weeds of sloth;
Nor any want-begotten rest.

I hold it true, whatever befall;
I feel it, when I sorrow most;
It is better to have loved and lost
Than never to have loved at all",102,"want-begotten rest, linnet born, captive void, true, rage, crime, woods, weeds, troth, time"
"Alfred, Lord Tennyson",In Memoriam A. H. H. OBIIT MDCCCXXXIII: 3,45330,"O Sorrow, cruel fellowship,
O Priestess in the vaults of Death,
O sweet and bitter in a breath,
What whispers from thy lying lip?

""The stars,"" she whispers, ""blindly run;
A web is wov'n across the sky;
From out waste places comes a cry,
And murmurs from the dying sun:

""And all the phantom, Nature, stands-
With all the music in her tone,
A hollow echo of my own,-
A hollow form with empty hands.""

And shall I take a thing so blind,
Embrace her as my natural good;
Or crush her, like a vice of blood,
Upon the threshold of the mind",109,"cruel fellowship, waste places, empty hands, hollow form, sorrow, natural, lying, embrace, death, blind, whispers, vice, vaults, tone, threshold"
"Alfred, Lord Tennyson",In Memoriam A. H. H. OBIIT MDCCCXXXIII: 30,45337,"With trembling fingers did we weave
The holly round the Christmas hearth;
A rainy cloud possessed the earth,
And sadly fell our Christmas-eve.

At our old pastimes in the hall
We gamboled, making vain pretence
Of gladness, with an awful sense
Of one mute Shadow watching all.

We paused: the winds were in the beech:
We heard them sweep the winter land;
And in a circle hand-in-hand
Sat silent, looking each at each.

Then echo-like our voices rang;
We sung, tho' every eye was dim,
A merry song we sang with him
Last year: impetuously we sang:

We ceased: a gentler feeling crept
Upon us: surely rest is meet:
""They rest,"" we said, ""their sleep is sweet,""
And silence followed, and we wept.

Our voices took a higher range;
Once more we sang: ""They do not die
Nor lose their mortal sympathy,
Nor change to us, although they change;

""Rapt from the fickle and the frail
With gathered power, yet the same,
Pierces the keen seraphic flame
From orb to orb, from veil to veil.""

Rise, happy morn, rise, holy morn,
Draw forth the cheerful day from night:
O Father, touch the east, and light
The light that shone when Hope was born",210,"gentler feeling, happy morn, cheerful day, awful sense, vain pretence, mortal sympathy, feeling crept, rainy cloud, seraphic flame"
"Alfred, Lord Tennyson",In Memoriam A. H. H. OBIIT MDCCCXXXIII: 99,45350,"Risest thou thus, dim dawn, again,
So loud with voices of the birds,
So thick with lowings of the herds,
Day, when I lost the flower of men;

Who tremblest thro' thy darkling red
On yon swoll'n brook that bubbles fast
By meadows breathing of the past,
And woodlands holy to the dead;

Who murmurest in the foliaged eaves
A song that slights the coming care,
And Autumn laying here and there
A fiery finger on the leaves;

Who wakenest with thy balmy breath
To myriads on the genial earth,
Memories of bridal, or of birth,
And unto myriads more, of death.

O wheresoever those may be,
Betwixt the slumber of the poles,
To-day they count as kindred souls;
They know me not, but mourn with me",128,"genial earth, fiery finger, kindred souls, foliaged eaves, mourn, death, dead, care, voices, to-day, thick"
"Alfred, Lord Tennyson",In Memoriam A. H. H. OBIIT MDCCCXXXIII: 39,45338,"Old warder of these buried bones,
And answering now my random stroke
With fruitful cloud and living smoke,
Dark yew, that graspest at the stones

And dippest toward the dreamless head,
To thee too comes the golden hour
When flower is feeling after flower;
But Sorrow-fixt upon the dead,

And darkening the dark graves of men,-
What whispered from her lying lips?
Thy gloom is kindled at the tips,
And passes into gloom again",74,"dark graves, fruitful cloud, dreamless head, dark yew, lying, gloom, feeling, dead, warder"
"Alfred, Lord Tennyson",In Memoriam A. H. H. OBIIT MDCCCXXXIII: 44,45339,"How fares it with the happy dead?
For here the man is more and more;
But he forgets the days before
God shut the doorways of his head.

The days have vanished, tone and tint,
And yet perhaps the hoarding sense
Gives out at times (he knows not whence)
A little flash, a mystic hint;

And in the long harmonious years
(If Death so taste Lethean springs),
May some dim touch of earthly things
Surprise thee ranging with thy peers.

If such a dreamy touch should fall,
O turn thee round, resolve the doubt;
My guardian angel will speak out
In that high place, and tell thee all",108,"harmonious years, mystic hint, lethean springs, hoarding sense, high place, earthly things, dreamy touch, surprise"
"Alfred, Lord Tennyson",In Memoriam A. H. H. OBIIT MDCCCXXXIII: 45,45340,"The baby new to earth and sky,
What time his tender palm is prest
Against the circle of the breast,
Has never thought that ""this is I"":

But as he grows he gathers much,
And learns the use of ""I,"" and ""me,""
And finds ""I am not what I see,
And other than the things I touch.""

So rounds he to a separate mind
From whence clear memory may begin,
As thro' the frame that binds him in
His isolation grows defined.

This use may lie in blood and breath
Which else were fruitless of their due,
Had man to learn himself anew
Beyond the second birth of Death",117,"isolation grows, clear memory, tender palm, separate mind, death, touch, time, things, prest, fruitless, frame"
"Alfred, Lord Tennyson",In Memoriam A. H. H. OBIIT MDCCCXXXIII: 5,45331,"I sometimes hold it half a sin
To put in words the grief I feel;
For words, like Nature, half reveal
And half conceal the Soul within.

But, for the unquiet heart and brain,
A use in measured language lies;
The sad mechanic exercise,
Like dull narcotics, numbing pain.

In words, like weeds, I'll wrap me over,
Like coarsest clothes against the cold;
But that large grief which these enfold
Is given in outline and no more",78,"large grief, dull narcotics, unquiet heart, mechanic exercise, measured language, coarsest clothes, pain, numbing, weeds, soul, reveal, outline, nature, half, enfold"
"Alfred, Lord Tennyson",In Memoriam A. H. H. OBIIT MDCCCXXXIII: 2,45329,"Old Yew, which graspest at the stones
That name the under-lying dead,
Thy fibres net the dreamless head,
Thy roots are wrapt about the bones.

The seasons bring the flower again,
And bring the firstling to the flock;
And in the dusk of thee, the clock
Beats out the little lives of men.

O not for thee the glow, the bloom,
Who changest not in any gale,
Nor branding summer suns avail
To touch thy thousand years of gloom:

And gazing on thee, sullen tree,
Sick for thy stubborn hardihood,
I seem to fail from out my blood
And grow incorporate into thee",103,"stubborn hardihood, dreamless head, sick, gloom, dead, years, wrapt, under-lying, tree"
"Alfred, Lord Tennyson",In Memoriam A. H. H. OBIIT MDCCCXXXIII: 54,45341,"Oh, yet we trust that somehow good
Will be the final end of ill,
To pangs of nature, sins of will,
Defects of doubt, and taints of blood;

That nothing walks with aimless feet;
That not one life shall be destroyed,
Or cast as rubbish to the void,
When God hath made the pile complete;

That not a worm is cloven in vain;
That not a moth with vain desire
Is shrivelled in a fruitless fire,
Or but subserves another's gain.

Behold, we know not anything;
I can but trust that good shall fall
At last-far off-at last, to all,
And every winter change to spring.

So runs my dream: but what am I?
An infant crying in the night:
An infant crying for the light:
And with no language but a cry",134,"infant crying, fruitless fire, final end, aimless feet, vain, sins, gain, dream, doubt, defects, worm"
"Alfred, Lord Tennyson",In Memoriam A. H. H. OBIIT MDCCCXXXIII: 55,45342,"The wish, that of the living whole
No life may fail beyond the grave,
Derives it not from what we have
The likest God within the soul?

Are God and Nature then at strife,
That Nature lends such evil dreams?
So careful of the type she seems,
So careless of the single life;

That I, considering everywhere
Her secret meaning in her deeds,
And finding that of fifty seeds
She often brings but one to bear,

I falter where I firmly trod,
And falling with my weight of cares
Upon the great world's altar-stairs
That slope thro' darkness up to God,

I stretch lame hands of faith, and grope,
And gather dust and chaff, and call
To what I feel is Lord of all,
And faintly trust the larger hope",131,"lame hands, likest god, evil dreams, single life, secret meaning, nature lends, grave, falling"
"Alfred, Lord Tennyson","from
  
  Maud: O that 'twere possible",50292,"O that 'twere possible
After long grief and pain
To find the arms of my true love
Round me once again!...

A shadow flits before me,
Not thou, but like to thee:
Ah, Christ! that it were possible
For one short hour to see
The souls we loved, that they might tell us
What and where they be",59,"short hour, shadow flits, true, pain, grief, souls, christ, arms"
"Alfred, Lord Tennyson",In Memoriam A. H. H. OBIIT MDCCCXXXIII: 67,45343,"When on my bed the moonlight falls,
I know that in thy place of rest
By that broad water of the west,
There comes a glory on the walls:

Thy marble bright in dark appears,
As slowly steals a silver flame
Along the letters of thy name,
And over the number of thy years.

The mystic glory swims away;
From off my bed the moonlight dies;
And closing eaves of wearied eyes
I sleep till dusk is dipt in gray:

And then I know the mist is drawn
A lucid veil from coast to coast,
And in the dark church like a ghost
Thy tablet glimmers to the dawn",109,"marble bright, wearied eyes, tablet glimmers, silver flame, lucid veil, dark church, broad water, number, ghost, years, west, walls"
"Alfred, Lord Tennyson",In Memoriam A. H. H. OBIIT MDCCCXXXIII: 96,45349,"You say, but with no touch of scorn,
Sweet-hearted, you, whose light-blue eyes
Are tender over drowning flies,
You tell me, doubt is Devil-born.

I know not: one indeed I knew
In many a subtle question versed,
Who touched a jarring lyre at first,
But ever strove to make it true:

Perplext in faith, but pure in deeds,
At last he beat his music out.
There lives more faith in honest doubt,
Believe me, than in half the creeds.

He fought his doubts and gathered strength,
He would not make his judgment blind,
He faced the spectres of the mind
And laid them: thus he came at length

To find a stronger faith his own;
And Power was with him in the night,
Which makes the darkness and the light,
And dwells not in the light alone,

But in the darkness and the cloud,
As over Sinaï's peaks of old,
While Israel made their gods of gold,
Altho' the trumpet blew so loud",164,"gathered strength, judgment blind, honest doubt, subtle question, light-blue eyes, jarring lyre, true, stronger, scorn, doubts, darkness, trumpet, touch, tender"
"Alfred, Lord Tennyson",In Memoriam A. H. H. OBIIT MDCCCXXXIII: 7,45332,"Dark house, by which once more I stand
Here in the long unlovely street,
Doors, where my heart was used to beat
So quickly, waiting for a hand,

A hand that can be clasped no more-
Behold me, for I cannot sleep,
And like a guilty thing I creep
At earliest morning to the door.

He is not here; but far away
The noise of life begins again,
And ghastly thro' the drizzling rain
On the bald street breaks the blank day",83,"unlovely street, street breaks, life begins, earliest morning, blank day, bald street, hand, guilty, waiting, rain, quickly, noise, more, house, heart"
"Alfred, Lord Tennyson","from
  
  Merlin and Vivien",50303,"In Love, if Love be Love, if Love be ours,
Faith and unfaith can never be equal powers:
Unfaith in aught is want of faith in all.

It is the little rift within the lute,
That by and by will make the music mute,
And ever widening slowly silence all.

The little rift within the lover's lute,
Or little pitted speck in garnered fruit,
That rotting inward slowly moulders all.

It is not worth the keeping: let it go:
But shall it? answer, darling, answer, no.
And trust me not at all or all in all",97,"slowly moulders, pitted speck, music mute, garnered fruit, equal powers, worth, lover, darling"
"Alfred, Lord Tennyson",The Higher Pantheism,45323,"The sun, the moon, the stars, the seas, the hills and the plains,-
Are not these, O Soul, the Vision of Him who reigns?

Is not the Vision He, tho' He be not that which He seems?
Dreams are true while they last, and do we not live in dreams?

Earth, these solid stars, this weight of body and limb,
Are they not sign and symbol of thy division from Him?

Dark is the world to thee; thyself art the reason why,
For is He not all but thou, that hast power to feel ""I am I""?

Glory about thee, without thee; and thou fulfillest thy doom,
Making Him broken gleams and a stifled splendour and gloom.

Speak to Him, thou, for He hears, and Spirit with Spirit can meet-
Closer is He than breathing, and nearer than hands and feet.

God is law, say the wise; O soul, and let us rejoice,
For if He thunder by law the thunder is yet His voice.

Law is God, say some; no God at all, says the fool,
For all we have power to see is a straight staff bent in a pool;

And the ear of man cannot hear, and the eye of man cannot see;
But if we could see and hear, this Vision-were it not He",222,"broken gleams, straight staff, solid stars, stifled splendour, staff bent, wise, vision, true, spirit, gloom, fool, dreams"
"Alfred, Lord Tennyson",In Memoriam A. H. H. OBIIT MDCCCXXXIII: 72,45344,"Risest thou thus, dim dawn, again,
And howlest, issuing out of night,
With blasts that blow the poplar white,
And lash with storm the streaming pane?

Day, when my crowned estate begun
To pine in that reverse of doom,
Which sickened every living bloom,
And blurred the splendour of the sun;

Who usherest in the dolorous hour
With thy quick tears that make the rose
Pull sideways, and the daisy close
Her crimson fringes to the shower;

Who might'st have heaved a windless flame
Up the deep East, or, whispering, played
A chequer-work of beam and shade
Along the hills, yet looked the same.

As wan, as chill, as wild as now;
Day, marked as with some hideous crime,
When the dark hand struck down thro' time,
And cancelled nature's best: but thou,

Lift as thou may'st thy burthened brows
Thro' clouds that drench the morning star,
And whirl the ungarnered sheaf afar,
And sow the sky with flying boughs,

And up thy vault with roaring sound
Climb thy thick noon, disastrous day;
Touch thy dull goal of joyless gray,
And hide thy shame beneath the ground",188,"disastrous day, joyless gray, hideous crime, dolorous hour, dark hand, dull goal, quick tears, windless flame, ungarnered sheaf, thick noon, sheaf afar, pull sideways, living bloom"
"Alfred, Lord Tennyson",In Memoriam A. H. H. OBIIT MDCCCXXXIII: 83,45347,"Dip down upon the northern shore
O sweet new-year delaying long;
Thou doest expectant nature wrong;
Delaying long, delay no more.

What stays thee from the clouded noons,
Thy sweetness from its proper place?
Can trouble live with April days,
Or sadness in the summer moons?

Bring orchis, bring the foxglove spire,
The little speed well's darling blue,
Deep tulips dashed with fiery dew,
Laburnums, dropping-wells of fire.

O thou new-year, delaying long,
Delayest the sorrow in my blood,
That longs to burst a frozen bud
And flood a fresher throat with song",94,"fiery dew, clouded noons, proper place, northern shore, new-year delaying, fresher throat, foxglove spire, expectant nature, deep tulips, bring orchis, wrong, trouble"
"Alfred, Lord Tennyson","from
  
  Idylls of the King: Song from The Marriage of Geraint",45326,"Turn, Fortune, turn thy wheel, and lower the proud;
Turn thy wild wheel thro' sunshine, storm, and cloud;
Thy wheel and thee we neither love nor hate.

Turn, Fortune, turn thy wheel with smile or frown;
With that wild wheel we go not up or down;
Our hoard is little, but our hearts are great.

Smile and we smile, the lords of many lands;
Frown and we smile, the lords of our own hands;
For man is man and master of his fate.

Turn, turn thy wheel above the staring crowd;
Thy wheel and thou are shadows in the cloud;
Thy wheel and thee we neither love nor hate",109,"wild wheel, staring crowd, smile, lower, turn, storm, master, lords, lands, hoard"
