Author,Title,Poetry Foundation ID,Content,Length,Topics
Sylvia Plath,The Colossus,89119,"I shall never get you put together entirely,
Pieced, glued, and properly jointed.
Mule-bray, pig-grunt and bawdy cackles
Proceed from your great lips.
It's worse than a barnyard.

Perhaps you consider yourself an oracle,
Mouthpiece of the dead, or of some god or other.
Thirty years now I have labored
To dredge the silt from your throat.
I am none the wiser.

Scaling little ladders with glue pots and pails of lysol
I crawl like an ant in mourning
Over the weedy acres of your brow
To mend the immense skull plates and clear
The bald, white tumuli of your eyes.

A blue sky out of the Oresteia
Arches above us. O father, all by yourself
You are pithy and historical as the Roman Forum.
I open my lunch on a hill of black cypress.
Your fluted bones and acanthine hair are littered

In their old anarchy to the horizon-line.
It would take more than a lightning-stroke
To create such a ruin.
Nights, I squat in the cornucopia
Of your left ear, out of the wind,

Counting the red stars and those of plum-color.
The sun rises under the pillar of your tongue.
My hours are married to shadow.
No longer do I listen for the scrape of a keel
On the blank stones of the landing",218,"white tumuli, weedy acres, skull plates, immense skull, glue pots, fluted bones, blue sky, blank stones, black cypress, bawdy cackles, acanthine hair, worse, wiser, ruin, mourning"
Sylvia Plath,The Applicant,57419,"First, are you our sort of a person?
Do you wear
A glass eye, false teeth or a crutch,
A brace or a hook,
Rubber breasts or a rubber crotch,

Stitches to show something's missing? No, no? Then
How can we give you a thing?
Stop crying.
Open your hand.
Empty? Empty. Here is a hand

To fill it and willing
To bring teacups and roll away headaches
And do whatever you tell it.
Will you marry it?
It is guaranteed

To thumb shut your eyes at the end
And dissolve of sorrow.
We make new stock from the salt.
I notice you are stark naked.
How about this suit--

Black and stiff, but not a bad fit.
Will you marry it?
It is waterproof, shatterproof, proof
Against fire and bombs through the roof.
Believe me, they'll bury you in it.

Now your head, excuse me, is empty.
I have the ticket for that.
Come here, sweetie, out of the closet.
Well, what do you think of that?
Naked as paper to start

But in twenty-five years she'll be silver,
In fifty, gold.
A living doll, everywhere you look.
It can sew, it can cook,
It can talk, talk, talk.

It works, there is nothing wrong with it.
You have a hole, it's a poultice.
You have an eye, it's an image.
My boy, it's your last resort.
Will you marry it, marry it, marry it",243,"twenty-five years, rubber crotch, rubber breasts, living doll, glass eye, false teeth, wrong, sweetie, sorrow"
Sylvia Plath,Edge,49009,"The woman is perfected.
Her dead

Body wears the smile of accomplishment,
The illusion of a Greek necessity

Flows in the scrolls of her toga,
Her bare

Feet seem to be saying:
We have come so far, it is over.

Each dead child coiled, a white serpent,
One at each little

Pitcher of milk, now empty.
She has folded

Them back into her body as petals
Of a rose close when the garden

Stiffens and odors bleed
From the sweet, deep throats of the night flower.

The moon has nothing to be sad about,
Staring from her hood of bone.

She is used to this sort of thing.
Her blacks crackle and drag",113,"dead child, white serpent, night flower, greek necessity, deep throats, sweet, smile, empty, drag, woman, toga"
Sylvia Plath,Nick and the Candlestick,49006,"I am a miner. The light burns blue.
Waxy stalactites
Drip and thicken, tears

The earthen womb
Exudes from its dead boredom.
Black bat airs

Wrap me, raggy shawls,
Cold homicides.
They weld to me like plums.

Old cave of calcium
Icicles, old echoer.
Even the newts are white,

Those holy Joes.
And the fish, the fish-
Christ! they are panes of ice,

A vice of knives,
A piranha
Religion, drinking

Its first communion out of my live toes.
The candle
Gulps and recovers its small altitude,

Its yellows hearten.
O love, how did you get here?
O embryo

Remembering, even in sleep,
Your crossed position.
The blood blooms clean

In you, ruby.
The pain
You wake to is not yours.

Love, love,
I have hung our cave with roses,
With soft rugs-

The last of Victoriana.
Let the stars
Plummet to their dark address,

Let the mercuric
Atoms that cripple drip
Into the terrible well,

You are the one
Solid the spaces lean on, envious.
You are the baby in the barn",173,"dead boredom, waxy stalactites, small altitude, raggy shawls, live toes, light burns, holy joes, earthen womb, dark address"
T. S. Eliot,Hysteria,44211,"As she laughed I was aware of becoming involved in her laughter and being part of it, until her teeth were only accidental stars with a talent for squad-drill. I was drawn in by short gasps, inhaled at each momentary recovery, lost finally in the dark caverns of her throat, bruised by the ripple of unseen muscles. An elderly waiter with trembling hands was hurriedly spreading a pink and white checked cloth over the rusty green iron table, saying: ""If the lady and gentleman wish to take their tea in the garden, if the lady and gentleman wish to take their tea in the garden ..."" I decided that if the shaking of her breasts could be stopped, some of the fragments of the afternoon might be collected, and I concentrated my attention with careful subtlety to this end",141,"careful subtlety, accidental stars, unseen muscles, short gasps, momentary recovery, iron table, green iron, elderly waiter, dark caverns, trembling, talent, shaking, laughter"
T. S. Eliot,Aunt Helen,44208,"Miss Helen Slingsby was my maiden aunt,
And lived in a small house near a fashionable square
Cared for by servants to the number of four.
Now when she died there was silence in heaven
And silence at her end of the street.
The shutters were drawn and the undertaker wiped his feet -
He was aware that this sort of thing had occurred before.
The dogs were handsomely provided for,
But shortly afterwards the parrot died too.
The Dresden clock continued ticking on the mantelpiece,
And the footman sat upon the dining-table
Holding the second housemaid on his knees -
Who had always been so careful while her mistress lived",109,"small house, maiden aunt, fashionable square, dresden clock, number, heaven, handsomely, careful, undertaker, ticking, street"
T. S. Eliot,Cousin Nancy,44210,"Miss Nancy Ellicott
Strode across the hills and broke them,
Rode across the hills and broke them -
The barren New England hills -
Riding to hounds
Over the cow-pasture.

Miss Nancy Ellicott smoked
And danced all the modern dances;
And her aunts were not quite sure how they felt about it,
But they knew that it was modern.

Upon the glazen shelves kept watch
Matthew and Waldo, guardians of the faith,
The army of unalterable law",75,"unalterable law, modern dances, glazen shelves, england hills, watch, strode, riding, hounds, guardians, ellicott, cow-pasture, barren, aunts, army"
T. S. Eliot,Whispers of Immortality,52563,"Webster was much possessed by death
And saw the skull beneath the skin;
And breastless creatures under ground
Leaned backward with a lipless grin.

Daffodil bulbs instead of balls
Stared from the sockets of the eyes!
He knew that thought clings round dead limbs
Tightening its lusts and luxuries.

Donne, I suppose, was such another
Who found no substitute for sense,
To seize and clutch and penetrate;
Expert beyond experience,

He knew the anguish of the marrow
The ague of the skeleton;
No contact possible to flesh
Allayed the fever of the bone.

.  .  .  .  ",93,"dead limbs, lipless grin, skull beneath, daffodil bulbs, breastless creatures, death, anguish, webster"
T. S. Eliot,La Figlia che Piange,47655,"O quam te memorem virgo ...
Stand on the highest pavement of the stair-
Lean on a garden urn-
Weave, weave the sunlight in your hair-
Clasp your flowers to you with a pained surprise-
Fling them to the ground and turn
With a fugitive resentment in your eyes:
But weave, weave the sunlight in your hair.

So I would have had him leave,
So I would have had her stand and grieve,
So he would have left
As the soul leaves the body torn and bruised,
As the mind deserts the body it has used.
I should find
Some way incomparably light and deft,
Some way we both should understand,
Simple and faithless as a smile and shake of the hand.

She turned away, but with the autumn weather
Compelled my imagination many days,
Many days and many hours:
Her hair over her arms and her arms full of flowers.
And I wonder how they should have been together!
I should have lost a gesture and a pose.
Sometimes these cogitations still amaze
The troubled midnight and the noon's repose",182,"troubled midnight, fugitive resentment, quam te, memorem virgo, highest pavement, torn, surprise, smile"
T. S. Eliot,The Boston Evening Transcript,44209,"The readers of the Boston Evening Transcript
Sway in the wind like a field of ripe corn.

When evening quickens faintly in the street,
Wakening the appetites of life in some
And to others bringing the Boston Evening Transcript,
I mount the steps and ring the bell, turning
Wearily, as one would turn to nod good-bye to Rochefoucauld,
If the street were time and he at the end of the street,
And I say, ""Cousin Harriet, here is the Boston Evening Transcript",83,"ripe corn, evening transcript, boston evening, wind, wearily, wakening, turning, time, sway, street, steps, ring, readers, quickens, life"
T. S. Eliot,Sweeney among the Nightingales,52564,"Apeneck Sweeney spread his knees
Letting his arms hang down to laugh,
The zebra stripes along his jaw
Swelling to maculate giraffe.

The circles of the stormy moon
Slide westward toward the River Plate,
Death and the Raven drift above
And Sweeney guards the hornèd gate.

Gloomy Orion and the Dog
Are veiled; and hushed the shrunken seas;
The person in the Spanish cape
Tries to sit on Sweeney's knees

Slips and pulls the table cloth
Overturns a coffee-cup,
Reorganised upon the floor
She yawns and draws a stocking up;

The silent man in mocha brown
Sprawls at the window-sill and gapes;
The waiter brings in oranges
Bananas figs and hothouse grapes;

The silent vertebrate in brown
Contracts and concentrates, withdraws;
Rachel née Rabinovitch
Tears at the grapes with murderous paws;

She and the lady in the cape
Are suspect, thought to be in league;
Therefore the man with heavy eyes
Declines the gambit, shows fatigue,

Leaves the room and reappears
Outside the window, leaning in,
Branches of wistaria
Circumscribe a golden grin;

The host with someone indistinct
Converses at the door apart,
The nightingales are singing near
The Convent of the Sacred Heart,

And sang within the bloody wood
When Agamemnon cried aloud
And let their liquid siftings fall
To stain the stiff dishonoured shroud.

1918, 1919",219,"murderous paws, bloody wood, gloomy orion, table cloth, sweeney guards, spanish cape, silent vertebrate"
Thomas Hardy,The Ruined Maid,44332,"O 'Melia, my dear, this does everything crown!
Who could have supposed I should meet you in Town?
And whence such fair garments, such prosperi-ty?"" -
""O didn't you know Ied been ruined?"" said she.

- ""You left us in tatters, without shoes or socks,
Tired of digging potatoes, and spudding up docks;
And now you've gay bracelets and bright feathers three!"" -
""Yes: that's how we dress when we're ruined,"" said she.

- ""At home in the barton you said thee' and thou,'
And thik oon,' and theäs oon,' and t'other'; but now
Your talking quite fits 'ee for high compa-ny!"" -
""Some polish is gained with one's ruin,"" said she.

- ""Your hands were like paws then, your face blue and bleak
But now I'm bewitched by your delicate cheek,
And your little gloves fit as on any la-dy!"" -
""We never do work when we're ruined,"" said she.

- ""You used to call home-life a hag-ridden dream,
And youed sigh, and youed sock; but at present you seem
To know not of megrims or melancho-ly!"" -
""True. One's pretty lively when ruined,"" said she.

- ""I wish I had feathers, a fine sweeping gown,
And a delicate face, and could strut about Town!"" -
""My dear - a raw country girl, such as you be,
Cannot quite expect that. You ain't ruined,"" said she",248,"bright feathers, gloves fit, fair garments, hag-ridden dream, delicate face, delicate cheek, thik oon, theäs oon"
Thomas Hardy,Satires of Circumstance in Fifteen Glimpses VIII: In the Study,47267,"He enters, and mute on the edge of a chair
Sits a thin-faced lady, a stranger there,
A type of decayed gentility;
And by some small signs he well can guess
That she comes to him almost breakfastless.

""I have called - I hope I do not err -
I am looking for a purchaser
Of some score volumes of the works
Of eminent divines I own, -
Left by my father - though it irks
My patience to offer them."" And she smiles
As if necessity were unknown;
""But the truth of it is that oftenwhiles
I have wished, as I am fond of art,
To make my rooms a little smart,
And these old books are so in the way.""
And lightly still she laughs to him,
As if to sell were a mere gay whim,
And that, to be frank, Life were indeed
To her not vinegar and gall,
But fresh and honey-like; and Need
No household skeleton at all",163,"decayed gentility, eminent divines, small signs, score volumes, household skeleton, truth, smart, fresh, fond, works"
Thomas Hardy,Channel Firing,46544,"That night your great guns, unawares,
Shook all our coffins as we lay,
And broke the chancel window-squares,
We thought it was the Judgment-day

And sat upright. While drearisome
Arose the howl of wakened hounds:
The mouse let fall the altar-crumb,
The worms drew back into the mounds,

The glebe cow drooled. Till God called, ""No;
It's gunnery practice out at sea
Just as before you went below;
The world is as it used to be:

""All nations striving strong to make
Red war yet redder. Mad as hatters
They do no more for Christés sake
Than you who are helpless in such matters.

""That this is not the judgment-hour
For some of them's a blessed thing,
For if it were theyed have to scour
Hell's floor for so much threatening....

""Ha, ha. It will be warmer when
I blow the trumpet (if indeed
I ever do; for you are men,
And rest eternal sorely need).""

So down we lay again. ""I wonder,
Will the world ever saner be,""
Said one, ""than when He sent us under
In our indifferent century!""

And many a skeleton shook his head.
""Instead of preaching forty year,""
My neighbour Parson Thirdly said,
""I wish I had stuck to pipes and beer.""

Again the guns disturbed the hour,
Roaring their readiness to avenge,
As far inland as Stourton Tower,
And Camelot, and starlit Stonehenge",246,"threatening , indifferent century, wakened hounds, stourton tower, starlit stonehenge, neighbour parson, gunnery practice, glebe cow, christés sake"
Thomas Hardy,According to the Mighty Working,57342,"I

When moiling seems at cease
In the vague void of night-time,
And heaven's wide roomage stormless
Between the dusk and light-time,
And fear at last is formless,
We call the allurement Peace.

II

Peace, this hid riot, Change,
This revel of quick-cued mumming,
This never truly being,
This evermore becoming,
This spinner's wheel onfleeing
Outside perception's range",61,"allurement peace, vague void, wide roomage, roomage stormless, quick-cued mumming, riot, heaven"
Thomas Hardy,England to Germany in 1914,57337,"Autumn 1914
'O England, may God punish thee!'
- Is it that Teuton genius flowers
Only to breathe malignity
Upon its friend of earlier hours?
- We have eaten your bread, you have eaten ours,
We have loved your burgs, your pines' green moan,
Fair Rhine-stream, and its storied towers;
Your shining souls of deathless dowers
Have won us as they were our own:

We have nursed no dreams to shed your blood,
We have matched your might not rancorously
Save a flushed few whose blatant mood
You heard and marked as well as we
To tongue not in their country's key;
But yet you cry with face aflame,
'O England, may God punish thee!'
And foul in onward history,
And present sight, your ancient name",125,"green moan, storied towers, present sight, onward history, genius flowers, face aflame, earlier hours, deathless dowers, blatant mood, punish, friend"
Thomas Hardy,The Voice,52333,"Woman much missed, how you call to me, call to me,
Saying that now you are not as you were
When you had changed from the one who was all to me,
But as at first, when our day was fair.

Can it be you that I hear? Let me view you, then,
Standing as when I drew near to the town
Where you would wait for me: yes, as I knew you then,
Even to the original air-blue gown!

Or is it only the breeze, in its listlessness
Travelling across the wet mead to me here,
You being ever dissolved to wan wistlessness,
Heard no more again far or near?

Thus I; faltering forward,
Leaves around me falling,
Wind oozing thin through the thorn from norward,
And the woman calling",131,"air-blue gown, original, falling, fair, woman, wistlessness, travelling"
Thomas Hardy,The Dead Man Walking,44326,"They hail me as one living,
But don't they know
That I have died of late years,
Untombed although?

I am but a shape that stands here,
A pulseless mould,
A pale past picture, screening
Ashes gone cold.

Not at a minute's warning,
Not in a loud hour,
For me ceased Time's enchantments
In hall and bower.

There was no tragic transit,
No catch of breath,
When silent seasons inched me
On to this death ....

- A Troubadour-youth I rambled
With Life for lyre,
The beats of being raging
In me like fire.

But when I practised eyeing
The goal of men,
It iced me, and I perished
A little then.

When passed my friend, my kinsfolk,
Through the Last Door,
And left me standing bleakly,
I died yet more;

And when my Love's heart kindled
In hate of me,
Wherefore I knew not, died I
One more degree.

And if when I died fully
I cannot say,
And changed into the corpse-thing
I am to-day,

Yet is it that, though whiling
The time somehow
In walking, talking, smiling,
I live not now",188,"death , tragic transit, silent seasons, pulseless mould, past picture, loud hour, late years, warning, smiling, raging, hate, friend, fire, whiling"
Thomas Hardy,Before Marching and After,57335,"
in
Memoriam F. W. G.)
Orion swung southward aslant
Where the starved Egdon pine-trees had thinned,
The Pleiads aloft seemed to pant
With the heather that twitched in the wind;
But he looked on indifferent to sights such as these,
Unswayed by love, friendship, home joy or home sorrow,
And wondered to what he would march on the morrow.

The crazed household-clock with its whirr
Rang midnight within as he stood,
He heard the low sighing of her
Who had striven from his birth for his good;
But he still only asked the spring starlight, the breeze,
What great thing or small thing his history would borrow
From that Game with Death he would play on the morrow.

When the heath wore the robe of late summer,
And the fuchsia-bells, hot in the sun,
Hung red by the door, a quick comer
Brought tidings that marching was done
For him who had joined in that game overseas
Where Death stood to win, though his name was to borrow
A brightness therefrom not to fade on the morrow",177,"crazed household-clock, swung southward, southward aslant, rang midnight, quick comer, orion swung, memoriam f, egdon pine-trees, starved, sorrow, indifferent, friendship"
Thomas Hardy,How She Went to Ireland,48715,"Dora's gone to Ireland
Through the sleet and snow;
Promptly she has gone there
In a ship, although
Why she's gone to Ireland
Dora does not know.

That was where, yea, Ireland,
Dora wished to be:
When she felt, in lone times,
Shoots of misery,
Often there, in Ireland,
Dora wished to be.

Hence she's gone to Ireland,
Since she meant to go,
Through the drift and darkness
Onward labouring, though
That she's gone to Ireland
Dora does not know",84,"lone times, misery, darkness, snow, sleet, shoots, ship, promptly, onward"
Thomas Hardy,The Last Performance,92493,"""I am playing my oldest tunes,"" declared she,
""All the old tunes I know,-
Those I learnt ever so long ago.""
-Why she should think just then sheed play them
Silence cloaks like snow.

When I returned from the town at nightfall
Notes continued to pour
As when I had left two hours before:
""It's the very last time,"" she said in closing;
""From now I play no more.""

A few morns onward found her fading,
And, as her life outflew,
I thought of her playing her tunes right through;
And I felt she had known of what was coming,
And wondered how she knew",114,"silence cloaks, oldest tunes, life outflew, playing, town, time, snow, onward, notes"
Thomas Hardy,The Darkling Thrush,44325,"I leant upon a coppice gate
When Frost was spectre-grey,
And Winter's dregs made desolate
The weakening eye of day.
The tangled bine-stems scored the sky
Like strings of broken lyres,
And all mankind that haunted nigh
Had sought their household fires.

The land's sharp features seemed to be
The Century's corpse outleant,
His crypt the cloudy canopy,
The wind his death-lament.
The ancient pulse of germ and birth
Was shrunken hard and dry,
And every spirit upon earth
Seemed fervourless as I.

At once a voice arose among
The bleak twigs overhead
In a full-hearted evensong
Of joy illimited;
An aged thrush, frail, gaunt, and small,
In blast-beruffled plume,
Had chosen thus to fling his soul
Upon the growing gloom.

So little cause for carolings
Of such ecstatic sound
Was written on terrestrial things
Afar or nigh around,
That I could think there trembled through
His happy good-night air
Some blessed Hope, whereof he knew
And I was unaware",163,"corpse outleant, ecstatic sound, broken lyres, voice arose, terrestrial things, tangled bine-stems, sharp features, household fires, good-night air, coppice gate, cloudy canopy, bleak twigs, blast-beruffled plume, ancient pulse"
Thomas Hardy,In Tenebris,44328,"""Percussus sum sicut foenum, et aruit cor meum."" -
Ps.
ci.
Wintertime nighs;
But my bereavement-pain
It cannot bring again:
Twice no one dies.

Flower-petals flee;
But, since it once hath been,
No more that severing scene
Can harrow me.

Birds faint in dread:
I shall not lose old strength
In the lone frost's black length:
Strength long since fled!

Leaves freeze to dun;
But friends can not turn cold
This season as of old
For him with none.

Tempests may scath;
But love can not make smart
Again this year his heart
Who no heart hath.

Black is night's cope;
But death will not appal
One who, past doubtings all,
Waits in unhope",118,"lone frost, wintertime nighs, sicut foenum, percussus sum, past doubtings, black length, aruit cor, strength, smart, friends, freeze, dread"
Thomas Hardy,Men Who March Away,57195,"What of the faith and fire within us
Men who march away
Ere the barn-cocks say
Night is growing gray,
Leaving all that here can win us;
What of the faith and fire within us
Men who march away?


Is it a purblind prank, O think you,
Friend with the musing eye,
Who watch us stepping by
With doubt and dolorous sigh?
Can much pondering so hoodwink you!
Is it a purblind prank, O think you,
Friend with the musing eye?


Nay. We well see what we are doing,
Though some may not see-
Dalliers as they be-
England's need are we;
Her distress would leave us rueing:
Nay. We well see what we are doing,
Though some may not see!


In our heart of hearts believing
Victory crowns the just,
And that braggarts must
Surely bite the dust,
Press we to the field ungrieving,
In our heart of hearts believing
Victory crowns the just.


Hence the faith and fire within us
Men who march away
Ere the barn-cocks say
Night is growing gray,
Leaving all that here can win us;
Hence the faith and fire within us
Men who march away",193,"dolorous sigh, purblind prank, musing eye, field ungrieving, surely, growing, friend, fire, doubt, distress, victory, stepping, rueing, press, night"
Thomas Hardy,No Buyers,44331,"A Load of brushes and baskets and cradles and chairs
Labours along the street in the rain:
With it a man, a woman, a pony with whiteybrown hairs. -
The man foots in front of the horse with a shambling sway
At a slower tread than a funeral train,
While to a dirge-like tune he chants his wares,
Swinging a Turk's-head brush (in a drum-major's way
When the bandsmen march and play).

A yard from the back of the man is the whiteybrown pony's nose:
He mirrors his master in every item of pace and pose:
He stops when the man stops, without being told,
And seems to be eased by a pause; too plainly he's old,
Indeed, not strength enough shows
To steer the disjointed waggon straight,
Which wriggles left and right in a rambling line,
Deflected thus by its own warp and weight,
And pushing the pony with it in each incline.

The woman walks on the pavement verge,
Parallel to the man:
She wears an apron white and wide in span,
And carries a like Turk's-head, but more in nursing-wise:
Now and then she joins in his dirge,
But as if her thoughts were on distant things,
The rain clams her apron till it clings. -
So, step by step, they move with their merchandize,
And nobody buys",222,"funeral train, disjointed waggon, waggon straight, whiteybrown pony, whiteybrown hairs, turk's-head brush, slower tread, pavement verge, distant things, dirge-like tune, strength, play, yard"
